[
  {
    "id": "report-first-vapi-campaign",
    "type": "report",
    "name": "First Vapi cold-call campaign report",
    "path_or_url": "outreach/vapi-campaign-report.md",
    "status": "active",
    "last_touched_at": "2026-07-08T21:06:50Z",
    "why_it_matters": "Shows IVR/DTMF failure and big-company calling lessons.",
    "source_paths": [
      "private-source-redacted"
    ],
    "evidence_link": "private-source-redacted",
    "generated_at": "2026-07-09T15:00:14Z",
    "source_hashes": {}
  },
  {
    "id": "offer-doc-home-service-ai-follow-up",
    "type": "offer_doc",
    "name": "Home Service AI Follow-Up Starter",
    "path_or_url": "offers/home-service-ai-follow-up-starter.md",
    "status": "active",
    "last_touched_at": "2026-07-08T19:26:58Z",
    "why_it_matters": "Defines the first monetizable offer and target customer.",
    "source_paths": [
      "private-source-redacted"
    ],
    "evidence_link": "private-source-redacted",
    "generated_at": "2026-07-09T15:00:14Z",
    "source_hashes": {}
  },
  {
    "id": "landing-page-home-service-offer",
    "type": "landing_page",
    "name": "Home-service follow-up landing page",
    "path_or_url": "landing/index.html",
    "status": "active",
    "last_touched_at": "2026-07-08T19:54:23Z",
    "why_it_matters": "Public conversion asset for the offer.",
    "source_paths": [
      "private-source-redacted"
    ],
    "evidence_link": "private-source-redacted",
    "generated_at": "2026-07-09T15:00:14Z",
    "source_hashes": {}
  },
  {
    "id": "report-owner-operated-vapi",
    "type": "report",
    "name": "Owner-operated Vapi after-hours report",
    "path_or_url": "outreach/owner-operated-vapi-report.md",
    "status": "active",
    "last_touched_at": "2026-07-08T21:17:22Z",
    "why_it_matters": "Evidence that owner-operated prospects are a better next call target.",
    "source_paths": [
      "private-source-redacted"
    ],
    "evidence_link": "private-source-redacted",
    "generated_at": "2026-07-09T15:00:14Z",
    "source_hashes": {}
  },
  {
    "id": "script-business-hours-calls",
    "type": "script",
    "name": "Owner-operated business-hours call runner",
    "path_or_url": "outreach/run-owner-operated-business-hours-calls.sh",
    "status": "active",
    "last_touched_at": "2026-07-08T22:52:55Z",
    "why_it_matters": "Prepared next campaign script for the strongest follow-up action.",
    "source_paths": [
      "private-source-redacted"
    ],
    "evidence_link": "private-source-redacted",
    "generated_at": "2026-07-09T15:00:14Z",
    "source_hashes": {}
  },
  {
    "id": "assistant-owner-operator-config",
    "type": "assistant",
    "name": "Owner-operator Vapi assistant config",
    "path_or_url": "outreach/vapi-owner-operator-cost-controlled-config.json",
    "status": "active",
    "last_touched_at": "2026-07-08T22:52:39Z",
    "why_it_matters": "Current assistant behavior for smaller local prospects.",
    "source_paths": [
      "private-source-redacted"
    ],
    "evidence_link": "private-source-redacted",
    "generated_at": "2026-07-09T15:00:14Z",
    "source_hashes": {}
  },
  {
    "id": "policy-vapi-cost-control",
    "type": "report",
    "name": "Vapi cost-control fix",
    "path_or_url": "outreach/vapi-cost-control-fix.md",
    "status": "active",
    "last_touched_at": "2026-07-08T22:53:17Z",
    "why_it_matters": "Documents call-cost guardrails after early campaign learning.",
    "source_paths": [
      "private-source-redacted"
    ],
    "evidence_link": "private-source-redacted",
    "generated_at": "2026-07-09T15:00:14Z",
    "source_hashes": {}
  }
]
